{"contract_version":"industry-vocabulary.v1","vocabulary_id":"real-estate","version":"1.0.0","kind":"industry","canonical_industry":"real_estate","aliases":["real estate","property development"],"concepts":[{"concept_id":"gross_development_value","label":"Gross development value","aliases":["gdv"]},{"concept_id":"gross_floor_area","label":"Gross floor area","aliases":["gfa"]},{"concept_id":"occupancy_rate","label":"Occupancy rate","aliases":[]},{"concept_id":"construction_cost","label":"Construction cost","aliases":[]}]}
