{"contract_version":"industry-vocabulary.v1","vocabulary_id":"logistics","version":"1.0.0","kind":"industry","canonical_industry":"logistics","aliases":["freight","transport and logistics"],"concepts":[{"concept_id":"shipment_volume","label":"Shipment volume","aliases":["shipments"]},{"concept_id":"revenue_per_shipment","label":"Revenue per shipment","aliases":[]},{"concept_id":"cost_per_shipment","label":"Cost per shipment","aliases":[]},{"concept_id":"fleet_utilization","label":"Fleet utilization","aliases":[]}]}
