{"contract_version":"industry-vocabulary.v1","vocabulary_id":"energy","version":"1.0.0","kind":"industry","canonical_industry":"energy","aliases":["power","utilities"],"concepts":[{"concept_id":"generation_capacity","label":"Generation capacity","aliases":[]},{"concept_id":"capacity_factor","label":"Capacity factor","aliases":[]},{"concept_id":"energy_price","label":"Energy price","aliases":[]},{"concept_id":"operating_availability","label":"Operating availability","aliases":[]}]}
