{"contract_version":"industry-vocabulary.v1","vocabulary_id":"hospitality","version":"1.0.0","kind":"industry","canonical_industry":"hospitality","aliases":["hotels","hotel"],"concepts":[{"concept_id":"available_room_nights","label":"Available room nights","aliases":[]},{"concept_id":"occupancy_rate","label":"Occupancy rate","aliases":[]},{"concept_id":"average_daily_rate","label":"Average daily rate","aliases":["adr"]},{"concept_id":"revenue_per_available_room","label":"Revenue per available room","aliases":["revpar"]}]}
