{"contract_version":"industry-vocabulary.v1","vocabulary_id":"insurance","version":"1.0.0","kind":"industry","canonical_industry":"insurance","aliases":["insurer","underwriting"],"concepts":[{"concept_id":"gross_written_premium","label":"Gross written premium","aliases":["gwp"]},{"concept_id":"loss_ratio","label":"Loss ratio","aliases":[]},{"concept_id":"expense_ratio","label":"Expense ratio","aliases":[]},{"concept_id":"combined_ratio","label":"Combined ratio","aliases":[]}]}
