{"contract_version":"industry-vocabulary.v1","vocabulary_id":"core-financials","version":"1.0.0","kind":"core","canonical_industry":null,"aliases":[],"concepts":[{"concept_id":"revenue","label":"Revenue","aliases":["sales"]},{"concept_id":"operating_costs","label":"Operating costs","aliases":["opex"]},{"concept_id":"capital_expenditure","label":"Capital expenditure","aliases":["capex"]},{"concept_id":"working_capital","label":"Working capital","aliases":[]}]}
