{"contract_version":"industry-vocabulary.v1","vocabulary_id":"banking","version":"1.0.0","kind":"industry","canonical_industry":"banking","aliases":["bank","commercial banking"],"concepts":[{"concept_id":"net_interest_margin","label":"Net interest margin","aliases":["nim"]},{"concept_id":"non_performing_loan_ratio","label":"Non-performing loan ratio","aliases":["npl ratio"]},{"concept_id":"capital_adequacy_ratio","label":"Capital adequacy ratio","aliases":["car"]},{"concept_id":"loan_to_deposit_ratio","label":"Loan-to-deposit ratio","aliases":["ldr"]}]}
