{"contract_version":"industry-vocabulary.v1","vocabulary_id":"saas","version":"1.0.0","kind":"industry","canonical_industry":"saas","aliases":["software as a service","subscription software"],"concepts":[{"concept_id":"monthly_recurring_revenue","label":"Monthly recurring revenue","aliases":["mrr"]},{"concept_id":"annual_recurring_revenue","label":"Annual recurring revenue","aliases":["arr"]},{"concept_id":"customer_count","label":"Customer count","aliases":["customers"]},{"concept_id":"customer_churn_rate","label":"Customer churn rate","aliases":["churn"]},{"concept_id":"average_revenue_per_customer","label":"Average revenue per customer","aliases":["arpc","arpu"]}]}
